{
  "claim_id": "C0007",
  "policy_id": "SYNTH-01",
  "policy": {
    "start_date": "2025-03-01",
    "sum_insured": "500000.00",
    "sum_insured_available": "500000.00",
    "riders": []
  },
  "claimant": {
    "dob": "1975-12-12",
    "declared_ped": null
  },
  "admission": {
    "admit_date": "2026-07-10",
    "discharge_date": "2026-07-13",
    "room_rent_per_day": "4000.00"
  },
  "narrative": "Admitted with uncontrolled blood sugar and diabetic foot ulcer. Diabetes duration not recorded. Proposal form on file does not include the pre-existing disease declaration.",
  "bill": [
    {
      "line_id": "L1",
      "description": "Room charges, 3 days",
      "amount": "12000.00"
    },
    {
      "line_id": "L2",
      "description": "Physician and surgeon visits",
      "amount": "5000.00"
    },
    {
      "line_id": "L3",
      "description": "Insulin, antibiotics and dressings",
      "amount": "9000.00"
    },
    {
      "line_id": "L4",
      "description": "Blood sugar profile and foot X-ray",
      "amount": "4000.00"
    }
  ]
}
